[
  {
    "number": "8.1.3",
    "platform": "ruby",
    "created_at": "2026-03-24T16:12:08.000Z",
    "downloads_count": 184227,
    "summary": "Full-stack web application framework.",
    "description": "Ruby on Rails is a full-stack web framework optimized for programmer happiness and sustainable productivity.",
    "authors": "David Heinemeier Hansson",
    "sha": "0a0a0a0a1b1b1b1b2c2c2c2c3d3d3d3d4e4e4e4e5f5f5f5f6a6a6a6a7b7b7b7b",
    "prerelease": false,
    "ruby_version": ">= 3.2.0",
    "rubygems_version": ">= 3.0.0",
    "licenses": ["MIT"],
    "requirements": []
  },
  {
    "number": "8.1.2",
    "platform": "ruby",
    "created_at": "2026-02-11T09:48:01.000Z",
    "downloads_count": 902817,
    "summary": "Full-stack web application framework.",
    "description": "Ruby on Rails is a full-stack web framework optimized for programmer happiness and sustainable productivity.",
    "authors": "David Heinemeier Hansson",
    "sha": "1b1b1b1b2c2c2c2c3d3d3d3d4e4e4e4e5f5f5f5f6a6a6a6a7b7b7b7b8c8c8c8c",
    "prerelease": false,
    "ruby_version": ">= 3.2.0",
    "rubygems_version": ">= 3.0.0",
    "licenses": ["MIT"],
    "requirements": []
  }
]
